{
  "authorizationId": "authorization-001",
  "projectId": "mcf-v1.1",
  "missionId": "MCF-V1.1-CODEX-IMPLEMENTATION-001",
  "grantedBy": "LEANDRO",
  "grantedAt": "2026-08-15T12:00:00Z",
  "actionClasses": ["LOCAL_CODE_CHANGE", "REMOTE_BRANCH_CHECKPOINT"],
  "environments": ["LOCAL", "GITHUB_BRANCH"],
  "maximumCost": null,
  "reversibleOnly": true,
  "boundary": "I1_TO_I10_EXCLUDING_MERGE_RELEASE_PRODUCTION",
  "exclusions": ["MERGE_MAIN", "RELEASE", "PRODUCTION_DEPLOY"],
  "evidenceRequirements": ["TEST_RESULTS", "EXACT_HEAD"],
  "sourceDecisionRef": "MCF-V1.1-IMPLEMENTATION-AUTHORIZATION-001",
  "status": "ACTIVE"
}
